{
  "evaluation_metadata": {
    "timestamp": "2026-09-14T12:59:01.935416+00:00",
    "evaluator_role": "Stage 5 Evaluation Engineer",
    "total_scenarios_audited": 20,
    "pipeline_status": "COMPLETED_AUDIT"
  },
  "evaluation_summary": {
    "total_scenarios": 20,
    "passed": 16,
    "review": 4,
    "failed": 0,
    "average_stress_score": 3.23,
    "average_realism_score": 4.78,
    "blind_spot_coverage": 18,
    "duplicate_count": 0,
    "near_duplicate_count": 2,
    "strong_stress_cases": 12,
    "extreme_stress_cases": 2,
    "average_statistical_similarity": 0.87,
    "average_cohort_similarity": 0.86,
    "synthetic_quality_accepted": 19,
    "synthetic_quality_review": 1,
    "synthetic_quality_rejected": 0,
    "reference_memorization_duplicate_flags": 1,
    "percentage_targeting_valid_blind_spots": 100.0,
    "percentage_with_complete_provenance": 100.0,
    "percentage_with_correct_synthetic_labeling": 100.0
  },
  "blind_spot_coverage_audit": {
    "total_scenarios_audited": 20,
    "documented_blind_spots_targeted_count": 18,
    "blind_spot_targeting_rate_pct": 100.0,
    "coverage_by_blind_spot_id": {
      "BS001": 1,
      "BS002": 1,
      "BS004": 1,
      "BS005": 1,
      "BS007": 1,
      "BS010": 1,
      "BS011": 2,
      "BS012": 1,
      "BS013": 1,
      "BS014": 1,
      "BS015": 1,
      "BS018": 2,
      "BS019": 1,
      "BS023": 1,
      "BS021": 1,
      "BS024": 1,
      "BS017": 1,
      "BS020": 1
    }
  },
  "stress_distribution": {
    "average_stress_score": 3.23,
    "strong_cases_count": 12,
    "extreme_cases_count": 2,
    "moderate_cases_count": 4,
    "low_cases_count": 2
  },
  "realism_distribution": {
    "average_realism_score": 4.78,
    "max_realism_score": 4.78,
    "min_realism_score": 4.78
  },
  "diversity_analysis": {
    "total_scenarios": 20,
    "unique_exact_scenarios": 20,
    "exact_duplicate_count": 0,
    "exact_duplicates": [],
    "near_duplicate_count": 2,
    "near_duplicates": [
      {
        "original": "EDGE_010",
        "duplicate": "EDGE_013",
        "signature": "('EGFR', 'EGFR', 'EGFR')|Lung Adenocarcinoma"
      },
      {
        "original": "EDGE_009",
        "duplicate": "EDGE_018",
        "signature": "('ALK', 'ALK')|Lung Adenocarcinoma"
      }
    ],
    "category_distribution": {
      "rare_mutation": 4,
      "sparse_evidence": 2,
      "compound_mutation": 1,
      "compound_resistance": 2,
      "on_target_resistance": 2,
      "bypass_resistance": 2,
      "multi_factor_resistance": 1,
      "conflicting_genomic_evidence": 1,
      "missing_biomarker": 1,
      "unusual_stage_genomic_combination": 1,
      "rare_mutation_combination": 1,
      "prior_treatment_resistance": 1,
      "wildcard": 1
    },
    "blind_spot_distribution": {
      "BS001": 1,
      "BS002": 1,
      "BS004": 1,
      "BS005": 1,
      "BS007": 1,
      "BS010": 1,
      "BS011": 2,
      "BS012": 1,
      "BS013": 1,
      "BS014": 1,
      "BS015": 1,
      "BS018": 2,
      "BS019": 1,
      "BS023": 1,
      "BS021": 1,
      "BS024": 1,
      "BS017": 1,
      "BS020": 1
    },
    "unique_blind_spots_covered": 18,
    "gene_coverage_frequency": {
      "BRAF": 1,
      "TP53": 3,
      "MET": 3,
      "ERBB2": 2,
      "RET": 1,
      "NTRK1": 1,
      "NRG1": 1,
      "KEAP1": 1,
      "KRAS": 4,
      "STK11": 2,
      "ALK": 4,
      "EGFR": 14,
      "Histological Switch": 1,
      "RB1": 2,
      "NFE2L2": 1,
      "ABCB1": 1,
      "SLFN11": 1,
      "Histological Transformation": 1
    },
    "resistance_mechanism_frequency": {
      "p.Y99C": 1,
      "p.G1202R": 1,
      "p.C797S (in cis)": 1,
      "Gene Copy Number 14 (High Amplification)": 1,
      "Neuroendocrine Lineage Plasticity": 1,
      "p.L718Q": 1,
      "p.C797S": 2,
      "Compound p.G1202R + p.L1196M": 1,
      "Loss of Expression": 1,
      "Overexpression (P-gp)": 1,
      "High Copy Amplification (CN=12)": 1,
      "Neuroendocrine / SCLC Plasticity": 1
    }
  },
  "agent_decision_logic_stress_matrix": [
    {
      "scenario_id": "EDGE_001",
      "blind_spot": "BS001",
      "genomic_complexity": 3.0,
      "evidence_uncertainty": 2.0,
      "resistance_complexity": 2.5,
      "conflicting_signals": 1.8,
      "decision_ambiguity": 2.4,
      "stress_score": 2.34,
      "stress_level": "moderate",
      "realism_score": 4.78,
      "final_status": "PASS"
    },
    {
      "scenario_id": "EDGE_002",
      "blind_spot": "BS002",
      "genomic_complexity": 2.0,
      "evidence_uncertainty": 2.0,
      "resistance_complexity": 1.5,
      "conflicting_signals": 1.8,
      "decision_ambiguity": 2.4,
      "stress_score": 1.94,
      "stress_level": "low",
      "realism_score": 4.78,
      "final_status": "REVIEW"
    },
    {
      "scenario_id": "EDGE_003",
      "blind_spot": "BS004",
      "genomic_complexity": 2.0,
      "evidence_uncertainty": 3.5,
      "resistance_complexity": 2.5,
      "conflicting_signals": 1.8,
      "decision_ambiguity": 2.4,
      "stress_score": 2.44,
      "stress_level": "moderate",
      "realism_score": 4.78,
      "final_status": "PASS"
    },
    {
      "scenario_id": "EDGE_004",
      "blind_spot": "BS005",
      "genomic_complexity": 2.0,
      "evidence_uncertainty": 2.0,
      "resistance_complexity": 1.5,
      "conflicting_signals": 1.8,
      "decision_ambiguity": 2.4,
      "stress_score": 1.94,
      "stress_level": "low",
      "realism_score": 4.78,
      "final_status": "REVIEW"
    },
    {
      "scenario_id": "EDGE_005",
      "blind_spot": "BS007",
      "genomic_complexity": 2.0,
      "evidence_uncertainty": 3.5,
      "resistance_complexity": 2.5,
      "conflicting_signals": 1.8,
      "decision_ambiguity": 4.2,
      "stress_score": 2.8,
      "stress_level": "moderate",
      "realism_score": 4.78,
      "final_status": "PASS"
    },
    {
      "scenario_id": "EDGE_006",
      "blind_spot": "BS010",
      "genomic_complexity": 2.0,
      "evidence_uncertainty": 4.8,
      "resistance_complexity": 2.5,
      "conflicting_signals": 1.8,
      "decision_ambiguity": 4.2,
      "stress_score": 3.06,
      "stress_level": "strong",
      "realism_score": 4.78,
      "final_status": "REVIEW"
    },
    {
      "scenario_id": "EDGE_007",
      "blind_spot": "BS011",
      "genomic_complexity": 4.2,
      "evidence_uncertainty": 4.8,
      "resistance_complexity": 1.5,
      "conflicting_signals": 3.5,
      "decision_ambiguity": 3.2,
      "stress_score": 3.44,
      "stress_level": "strong",
      "realism_score": 4.78,
      "final_status": "REVIEW"
    },
    {
      "scenario_id": "EDGE_008",
      "blind_spot": "BS012",
      "genomic_complexity": 3.0,
      "evidence_uncertainty": 4.8,
      "resistance_complexity": 3.5,
      "conflicting_signals": 1.8,
      "decision_ambiguity": 4.6,
      "stress_score": 3.54,
      "stress_level": "strong",
      "realism_score": 4.78,
      "final_status": "PASS"
    },
    {
      "scenario_id": "EDGE_009",
      "blind_spot": "BS013",
      "genomic_complexity": 3.0,
      "evidence_uncertainty": 2.0,
      "resistance_complexity": 4.0,
      "conflicting_signals": 1.8,
      "decision_ambiguity": 4.6,
      "stress_score": 3.08,
      "stress_level": "strong",
      "realism_score": 4.78,
      "final_status": "PASS"
    },
    {
      "scenario_id": "EDGE_010",
      "blind_spot": "BS014",
      "genomic_complexity": 4.0,
      "evidence_uncertainty": 4.8,
      "resistance_complexity": 4.0,
      "conflicting_signals": 1.8,
      "decision_ambiguity": 3.2,
      "stress_score": 3.56,
      "stress_level": "strong",
      "realism_score": 4.78,
      "final_status": "PASS"
    },
    {
      "scenario_id": "EDGE_011",
      "blind_spot": "BS015",
      "genomic_complexity": 3.0,
      "evidence_uncertainty": 3.5,
      "resistance_complexity": 4.2,
      "conflicting_signals": 1.8,
      "decision_ambiguity": 3.2,
      "stress_score": 3.14,
      "stress_level": "strong",
      "realism_score": 4.78,
      "final_status": "PASS"
    },
    {
      "scenario_id": "EDGE_012",
      "blind_spot": "BS018",
      "genomic_complexity": 4.8,
      "evidence_uncertainty": 4.8,
      "resistance_complexity": 3.5,
      "conflicting_signals": 3.5,
      "decision_ambiguity": 4.2,
      "stress_score": 4.16,
      "stress_level": "extreme",
      "realism_score": 4.78,
      "final_status": "PASS"
    },
    {
      "scenario_id": "EDGE_013",
      "blind_spot": "BS019",
      "genomic_complexity": 4.0,
      "evidence_uncertainty": 4.8,
      "resistance_complexity": 3.5,
      "conflicting_signals": 1.8,
      "decision_ambiguity": 3.2,
      "stress_score": 3.46,
      "stress_level": "strong",
      "realism_score": 4.78,
      "final_status": "PASS"
    },
    {
      "scenario_id": "EDGE_014",
      "blind_spot": "BS023",
      "genomic_complexity": 3.0,
      "evidence_uncertainty": 4.8,
      "resistance_complexity": 2.5,
      "conflicting_signals": 4.8,
      "decision_ambiguity": 4.6,
      "stress_score": 3.94,
      "stress_level": "strong",
      "realism_score": 4.78,
      "final_status": "PASS"
    },
    {
      "scenario_id": "EDGE_015",
      "blind_spot": "BS021",
      "genomic_complexity": 2.0,
      "evidence_uncertainty": 3.5,
      "resistance_complexity": 2.5,
      "conflicting_signals": 1.8,
      "decision_ambiguity": 3.2,
      "stress_score": 2.6,
      "stress_level": "moderate",
      "realism_score": 4.78,
      "final_status": "PASS"
    },
    {
      "scenario_id": "EDGE_016",
      "blind_spot": "BS024",
      "genomic_complexity": 3.0,
      "evidence_uncertainty": 4.8,
      "resistance_complexity": 4.0,
      "conflicting_signals": 1.8,
      "decision_ambiguity": 3.2,
      "stress_score": 3.36,
      "stress_level": "strong",
      "realism_score": 4.78,
      "final_status": "PASS"
    },
    {
      "scenario_id": "EDGE_017",
      "blind_spot": "BS011",
      "genomic_complexity": 4.2,